{
  "$schema": "../schemas/manifest.schema.json",
  "schema_version": "2.0.0",
  "manifest_id": "chaulieu_jr_op9",
  "generated_on": "2026-09-30",
  "group": "piano_core",
  "notes": [
    "24 piano preludes; attributed by IMSLP to Chaulieu Jr.; no key order is assumed."
  ],
  "pieces": [
    {
      "piece_id": "chaulieu_jr_op9_001",
      "canonical_work_id": "chaulieu_jr_op9_001",
      "record_kind": "work",
      "display_title": "24 Little Preludes — Prelude 1",
      "catalogue_group": "piano_core",
      "known_metadata": {
        "composer": "Charles Chaulieu Jr.",
        "collection_id": "chaulieu_jr_op9",
        "collection_title": "24 Petits préludes",
        "opus_or_catalogue": "Op.9",
        "number": "1",
        "subdivision": null,
        "original_title": null,
        "instrumentation": "piano_solo",
        "source_reported_key": null,
        "metadata_basis": "catalogue_enumeration"
      },
      "pedagogy": {
        "intended_use": [
          "sight_reading"
        ],
        "curation_priority": 1,
        "verified_suitability": null,
        "tags": []
      },
      "availability": {
        "status": "catalogue_only",
        "download_status": "pending",
        "local_score_path": null,
        "selected_asset_id": null,
        "playable": false
      },
      "assets": [],
      "rights": {
        "composition_status": "public_domain_reported",
        "edition_status": "pending_review",
        "license_id": null,
        "evidence_ids": [
          "imslp_chaulieu_jr_op9"
        ],
        "attribution": "Charles Chaulieu Jr.; bibliographic reference: IMSLP (https://imslp.org/wiki/24_Petits_pr%C3%A9ludes%2C_Op.9_%28Chaulieu_Jr.%2C_Charles%29).",
        "target_jurisdictions": [],
        "distribution_status": "pending_review"
      },
      "provenance": [
        {
          "evidence_id": "imslp_chaulieu_jr_op9",
          "fields": [
            "known_metadata",
            "piece_id",
            "display_title",
            "rights.composition_status"
          ],
          "source_record": "1"
        }
      ],
      "analysis": {
        "status": "pending",
        "parser_version": null,
        "algorithm_version": null,
        "input_asset_id": null,
        "input_sha256": null,
        "computed_at": null,
        "error": null,
        "metrics": {
          "measure_count": null,
          "duration_quarter_notes": null,
          "key_signatures": null,
          "estimated_key": null,
          "time_signatures": null,
          "lowest_note": null,
          "highest_note": null,
          "right_hand_range": null,
          "left_hand_range": null,
          "hand_assignment": null,
          "accidentals": null,
          "voice_count": null,
          "max_chord_notes": null,
          "max_simultaneous_notes": null,
          "max_melodic_leap_semitones": null,
          "rhythm_values": null,
          "tuplets_present": null,
          "syncopation_ratio": null,
          "note_density_per_quarter": null,
          "hand_independence_score": null,
          "sightreading_score": null,
          "sightreading_level": null
        },
        "warnings": []
      },
      "notes": [
        "Individual entry enumerated from the catalogue; the display title is an editorial label. This does not imply that a MusicXML file has been located."
      ]
    },
    {
      "piece_id": "chaulieu_jr_op9_002",
      "canonical_work_id": "chaulieu_jr_op9_002",
      "record_kind": "work",
      "display_title": "24 Little Preludes — Prelude 2",
      "catalogue_group": "piano_core",
      "known_metadata": {
        "composer": "Charles Chaulieu Jr.",
        "collection_id": "chaulieu_jr_op9",
        "collection_title": "24 Petits préludes",
        "opus_or_catalogue": "Op.9",
        "number": "2",
        "subdivision": null,
        "original_title": null,
        "instrumentation": "piano_solo",
        "source_reported_key": null,
        "metadata_basis": "catalogue_enumeration"
      },
      "pedagogy": {
        "intended_use": [
          "sight_reading"
        ],
        "curation_priority": 1,
        "verified_suitability": null,
        "tags": []
      },
      "availability": {
        "status": "catalogue_only",
        "download_status": "pending",
        "local_score_path": null,
        "selected_asset_id": null,
        "playable": false
      },
      "assets": [],
      "rights": {
        "composition_status": "public_domain_reported",
        "edition_status": "pending_review",
        "license_id": null,
        "evidence_ids": [
          "imslp_chaulieu_jr_op9"
        ],
        "attribution": "Charles Chaulieu Jr.; bibliographic reference: IMSLP (https://imslp.org/wiki/24_Petits_pr%C3%A9ludes%2C_Op.9_%28Chaulieu_Jr.%2C_Charles%29).",
        "target_jurisdictions": [],
        "distribution_status": "pending_review"
      },
      "provenance": [
        {
          "evidence_id": "imslp_chaulieu_jr_op9",
          "fields": [
            "known_metadata",
            "piece_id",
            "display_title",
            "rights.composition_status"
          ],
          "source_record": "2"
        }
      ],
      "analysis": {
        "status": "pending",
        "parser_version": null,
        "algorithm_version": null,
        "input_asset_id": null,
        "input_sha256": null,
        "computed_at": null,
        "error": null,
        "metrics": {
          "measure_count": null,
          "duration_quarter_notes": null,
          "key_signatures": null,
          "estimated_key": null,
          "time_signatures": null,
          "lowest_note": null,
          "highest_note": null,
          "right_hand_range": null,
          "left_hand_range": null,
          "hand_assignment": null,
          "accidentals": null,
          "voice_count": null,
          "max_chord_notes": null,
          "max_simultaneous_notes": null,
          "max_melodic_leap_semitones": null,
          "rhythm_values": null,
          "tuplets_present": null,
          "syncopation_ratio": null,
          "note_density_per_quarter": null,
          "hand_independence_score": null,
          "sightreading_score": null,
          "sightreading_level": null
        },
        "warnings": []
      },
      "notes": [
        "Individual entry enumerated from the catalogue; the display title is an editorial label. This does not imply that a MusicXML file has been located."
      ]
    },
    {
      "piece_id": "chaulieu_jr_op9_003",
      "canonical_work_id": "chaulieu_jr_op9_003",
      "record_kind": "work",
      "display_title": "24 Little Preludes — Prelude 3",
      "catalogue_group": "piano_core",
      "known_metadata": {
        "composer": "Charles Chaulieu Jr.",
        "collection_id": "chaulieu_jr_op9",
        "collection_title": "24 Petits préludes",
        "opus_or_catalogue": "Op.9",
        "number": "3",
        "subdivision": null,
        "original_title": null,
        "instrumentation": "piano_solo",
        "source_reported_key": null,
        "metadata_basis": "catalogue_enumeration"
      },
      "pedagogy": {
        "intended_use": [
          "sight_reading"
        ],
        "curation_priority": 1,
        "verified_suitability": null,
        "tags": []
      },
      "availability": {
        "status": "catalogue_only",
        "download_status": "pending",
        "local_score_path": null,
        "selected_asset_id": null,
        "playable": false
      },
      "assets": [],
      "rights": {
        "composition_status": "public_domain_reported",
        "edition_status": "pending_review",
        "license_id": null,
        "evidence_ids": [
          "imslp_chaulieu_jr_op9"
        ],
        "attribution": "Charles Chaulieu Jr.; bibliographic reference: IMSLP (https://imslp.org/wiki/24_Petits_pr%C3%A9ludes%2C_Op.9_%28Chaulieu_Jr.%2C_Charles%29).",
        "target_jurisdictions": [],
        "distribution_status": "pending_review"
      },
      "provenance": [
        {
          "evidence_id": "imslp_chaulieu_jr_op9",
          "fields": [
            "known_metadata",
            "piece_id",
            "display_title",
            "rights.composition_status"
          ],
          "source_record": "3"
        }
      ],
      "analysis": {
        "status": "pending",
        "parser_version": null,
        "algorithm_version": null,
        "input_asset_id": null,
        "input_sha256": null,
        "computed_at": null,
        "error": null,
        "metrics": {
          "measure_count": null,
          "duration_quarter_notes": null,
          "key_signatures": null,
          "estimated_key": null,
          "time_signatures": null,
          "lowest_note": null,
          "highest_note": null,
          "right_hand_range": null,
          "left_hand_range": null,
          "hand_assignment": null,
          "accidentals": null,
          "voice_count": null,
          "max_chord_notes": null,
          "max_simultaneous_notes": null,
          "max_melodic_leap_semitones": null,
          "rhythm_values": null,
          "tuplets_present": null,
          "syncopation_ratio": null,
          "note_density_per_quarter": null,
          "hand_independence_score": null,
          "sightreading_score": null,
          "sightreading_level": null
        },
        "warnings": []
      },
      "notes": [
        "Individual entry enumerated from the catalogue; the display title is an editorial label. This does not imply that a MusicXML file has been located."
      ]
    },
    {
      "piece_id": "chaulieu_jr_op9_004",
      "canonical_work_id": "chaulieu_jr_op9_004",
      "record_kind": "work",
      "display_title": "24 Little Preludes — Prelude 4",
      "catalogue_group": "piano_core",
      "known_metadata": {
        "composer": "Charles Chaulieu Jr.",
        "collection_id": "chaulieu_jr_op9",
        "collection_title": "24 Petits préludes",